post_id;text;image_url;views_count
715020;#help@kotrastet  ?? дом ?? Москва и МО  Марья, 3-4 месяца.   Кошечка Марья ищет любящих и ответственных хозяев. Ее братика и сестричку уже забрали, а она одиноко плачет на кухне передержки ??   Девочка была спасена из ужасных условий, они жили в гаражах, где негде было укрыться от непогоды и никаких шансов согреться, спали на голой земле.  Марья обработана от паразитов, кушает сухой и влажный корм.  Пока осторожна к людям, но это дело времени.   Пристраиваем строго в дом с установленными/готовностью установить сетки антикошка.   Обращаться можно в мессенджеры по номеру 89295055265;https://sun9-63.userapi.com/s/v1/ig2/oVWz-mdVHi6t2sQ9EwL2XrCLJR-VpBy1tR00D2hGS7OGW_8kwIG5Lovujc_mzZwY7MPEGhaOhG5APplzf6TeFj21.jpg?quality=95&as=32x23,48x34,72x51,108x77,160x114,240x171,360x257,480x343,540x386,640x457,720x514,1080x771,1280x914,1440x1029,1512x1080&from=bu&u=64CtS76UdRJ7LhAsLFjQaAkoG3HJrtJebAIHD-fTzAc&cs=510x364;6018
714989;Привет всем! Знакомьтесь с Максиком ??Вот так подрос малыш, подскажите, как вы защищаете своих малышей от клещей? Просто мы живем в частном доме, и кот сейчас часто бывает на улице и вот уже дважды подцепил клеща за месяц, переживаю, что он чем-то заразится.;https://sun9-76.userapi.com/s/v1/ig2/WJG_aiB3Ng8CeKQa0qX_z3OHZX3r5jqMcJNulg9Thq_I2zjQqMKKdF39okek35fG9ThyhV3ylZfINfTseWJASXuf.jpg?quality=95&as=32x43,48x64,72x96,108x144,160x213,240x320,360x480,480x640,540x720,640x853,720x960,960x1280&from=bu&u=tdqHf0gAxlqKFOCqw2MahUNXqsyVMdkKAjiVAfxc4bI&cs=510x680;8178
714967;Всем привет! Это моя любимая сладкая булка ) ему чуть больше года и зовут Флеш   Найден был возле офиса в кустах…сидел там весь день и не двигался с места. При ближайшем рассмотрении, оказалось что один глаз не видит, ходить практически не может и все время падает , весь в личинках и вшах…а шипит как дикая пантера )) И тут…сердце не выдержало  Пришлось забрать)  Муж дал три дня , чтобы пристроить это «чучело» на авито ),…чего конечно же я не сделала ) Прошло немного времени и гадкий утенок, стал упитанным и красивым котом ) Любит лазать по столам , есть креветки, рыться в цветах и делать кусь ))  P.s.: сейчас муж любит его даже больше меня ))так что все ок ?;https://sun9-74.userapi.com/s/v1/ig2/Ojh_QgNBvWrYSJsHX2Vw7JFGJB7HADy8_-ErrnEK_PnnmHk2bdgOt2kgm0UhfnYJZYu7iUwH6Zpjxm0j-KxKfiNw.jpg?quality=95&as=32x43,48x64,72x96,108x144,160x213,240x320,360x480,480x640,540x720,640x853,720x960,1080x1440,1280x1707,1440x1920,1920x2560&from=bu&u=H_Ze6daN2aMCdWnT-GqBT4J9CSQaE2vWf7nxfsc0jVw&cs=510x680;14139
714942;Всем привет! Хочу рассказать о своей любимой кошке по имени Мия. Мию нашла год назад у себя в подъезде, где она ,мягко говоря, была не в лучшем состоянии. Её подобрала соседняя девочка с подъезда,где она сказала,что Мия чуть не попала под машину. Чуть позже ,она познакомилась с моим дедушкой Баги ( ссылка на пост с Баги, если кому интересно: https://vk.com/wall-152141431_601966 ).   Она сначала всех боялась в доме, но потом начала привыкать. Баги её научил ходить в лоток ,хоть ему и тяжело было самому это делать. Мия начала со мной спать, играть, всё меньше боялась меня. Когда Баги не стало,она продолжила ходить к его лежанке и ждала его ??  Сейчас Мии год и три месяца , и я очень рада, что забрала её с улицы.;https://sun9-66.userapi.com/s/v1/ig2/0S22Dj5eyr6BFAT3-za5WEzrdGMOl2mJ4mX7sS-5ojTDbvJDQqKPjMXTG5I-_onKXDmYXl6g7puvN81YnZJU1Zq7.jpg?quality=95&as=32x24,48x36,72x54,108x81,160x120,240x180,360x270,480x360,540x405,640x480,720x540,1080x810,1280x960&from=bu&u=kARjXaQXyqso2x1KSvQkT3Ix3XMKs96wCnXaX1KASwE&cs=510x382;8825
714877;мой непоследливый, кусачий и иногда царапающийся, но всегда любимый Каспер ??  любит подрать кожаное игровое кресло, обожает носиться как угорелый, может позволить себя погладить, любит спать в ногах, на кровати, рядом   очень красивый, крутой, уже практически настоящий мужчина, ему около 6-7 месяцев, был привезен мне из другого города, где волонтерша нашла его в подвале   был очень маленький и сейчас уже в свои полгодика очень большой, мускулистый и сильный потому что носится как ненормальный   mybabymylove;https://sun9-40.userapi.com/s/v1/ig2/A_DoW3LByCaIJ9OGLafkbXSQsnLtvPFmW7KAUZ-0jqETd-tP--l8XO_PXj_yNIgo7en0Fpw-wTZi2qAlxAuDMuhi.jpg?quality=95&crop=0,0,1917,2560&as=32x43,48x64,72x96,108x144,160x214,240x320,360x481,480x641,540x721,640x855,720x961,1080x1442,1280x1709,1440x1923,1917x2560&from=bu&u=HUUz7fkAO_Yw0M0oJard0oPMP9TGYNtTb4m0CmroIjM&cs=540x721;23766
714854;Всем доброго денёчка?? Этого маленького пупсика зовут Мусик(а также Мусине,Мюсик,Кися и сынок) Нашла эту булочку на фарпосте. На 1ом фото его первый день в моём доме,он был такой маленький. На 3ем и 4ом фото мы в гостях у родителей и их кить. Пока он рос,он постоянно тыкался своей мордочкой в лицо и засыпал. И вплоть до сегодняшнего дня он так делает,хотя ему уже почти год...тяжело держать на себе такую свинку:d Обожает бегать,играть с мячиками,доставать других котиков в доме(они от него прятались,пока он был маленький) А также ему нравится доставать кули какули с лотка и катать их по полу?? но мы всё равно его очен любим Сейчас он уже большой и так грустно,что эти пупсики так быстро растут...??;https://sun9-19.userapi.com/s/v1/ig2/4NWTtu2qO8RU6P3JH3W92PyhW7dQZV-cR3WpRvdV3Ln8orE2o-OD4kGx1fW22fXudUEplexkIxfL8ZyqZBV45k7A.jpg?quality=95&as=32x43,48x64,72x96,108x144,160x213,240x320,360x480,480x640,540x720,640x853,720x960,1080x1440,1280x1707,1440x1920,1920x2560&from=bu&u=GTapkSm33eW8P8qataLRAoN-n1IyiOV_s-h8waJi2hA&cs=510x680;10513
714826;Всем привет, нашего малыша зовут Серичка, вот такой красавчик он у нас, очень сильно его полюбили, забрали мы его 3 недельного, родился он в деревне на улице, их выложили в группу, я сразу поняла что это мой котик, люблю его очень сильно, и всем желаю найти своих котиков, в приютах или пристраиваюших группах, они ждут нас ));https://sun9-75.userapi.com/s/v1/ig2/82nBVzs2TwEEPJbiJsnTNNbfp-cPC45j5OigBaBb1Jj0d3jUCkYBTzesQI6Ux6CAjcEzXAnPGucoN3T2OCMETSSb.jpg?quality=95&as=32x43,48x64,72x96,108x144,160x213,240x320,360x480,480x640,540x720,640x854,720x960,1080x1441,1280x1708,1440x1921,1919x2560&from=bu&u=SszU2KL1z_pZfLvz_8gLt29e14bqbL9DeU96zHC4eDw&cs=510x680;10838
714799;Рубль ?? 1 - 10 месяцев;https://sun9-37.userapi.com/s/v1/ig2/nWPGH-QLeJJQDwoViQr0OwcZe_YYbAjfPdLOoqv2QGELSJa5fF1eS1UoxKoM1PgEPzwHm_vf6kvn3CStCFnDkGtQ.jpg?quality=95&as=32x43,48x64,72x96,108x144,160x213,240x320,360x480,480x640,540x720,640x853,720x960,1080x1440,1280x1707,1440x1920,1920x2560&from=bu&u=-sjAqLC1tel4yzdFRxyEAzTsn2b0GHohRIA2qNkWj8Y&cs=510x680;13247
714726;Мои находки из помойки. Очень непросто было вырастить в условиях отсутствия отопления и наличия работы??Старшая кошка Василиса помогала с освоением лотка и когтеточки.Классные девчонки выросли - очень умные и совсем ручные.С рыжим пятнышком на лбу это Клёпа, а её вредную сестру зовут Зайка.Последнее фото вся банда в сборе;https://sun9-73.userapi.com/s/v1/ig2/ceQyfNFEIKNZV0j8Iirej-SgtXf60RvJHdtIDD0BDCvZ1kDTmz3TGTzKkZJkO7_M0E8myz5RZrgAOc5vI6IMhb3k.jpg?quality=95&as=32x43,48x64,72x96,108x144,160x213,240x320,360x480,480x640,540x720,640x853,720x960,1080x1440,1280x1707,1440x1920,1920x2560&from=bu&u=_L7iWpXCUnYC7SxmF8mzjMLRg1FkLVTtutrTAJOQpiM&cs=510x680;37204
714705;Тося aka Тося Чайкина Особые приметы: 8 лет Любит коробки,спать в раковине,закрадываться ночью в спальню и начинать блювать Требует открытых дверей во всей квартире;https://sun9-35.userapi.com/s/v1/ig2/Cl_w5u9HKMVQCuQUcLmIKcZ5B8pG8bj2ginIXWtBDTAlfZ-4IuVwft1gielRe9ZJme-LWoMTNv3H5yZYSzGvpNDI.jpg?quality=95&as=32x48,48x72,72x108,108x162,160x240,240x360,360x540,480x720,540x810,640x960,720x1080,1080x1621,1280x1921,1440x2161,1706x2560&from=bu&u=AjTWATVXupSGjDC8iGpwYNiPeUsq_cz8jqk8l6HViAI&cs=510x765;10140
714690;Моя булочка с окрасом сердца? Встретили ее на трассе и решили забрать?? Любит лазить везде особенно сидеть на моей спине??Будильник по утрам в придачу,по лицу бьет лапой это значит надо встать ее покормить и открыть окно смотреть птичек??;https://sun9-45.userapi.com/s/v1/ig2/PGR7A7Fpz6DlP94iWuEBbuA1-vBKmfghkqSBzJkdeL6HVNc24z7w-mXYaz7n6Y84BONaA0GIxrF3FLfxk6RH2qLx.jpg?quality=95&as=32x43,48x64,72x96,108x144,160x213,240x320,360x480,480x640,540x720,640x853,720x960,1080x1440,1280x1707,1440x1920,1920x2560&from=bu&u=Jsn2WY7Pm3QZLlSyUuB4jvKFxhxHDhJKtDnH9UnD7vg&cs=510x680;13508
714657;"Грустный пост   Года 3 назад уже знакомила вас с Кокси,которая прибилась ко мне пузатенькой с киндер сюрпризом.   В апреле этого года я заметила,что она кричит больше,чем обычно,когда её берёшь на руки ""подмышки"". Меня это забеспокоило и мы поехали к врачу,который нам сказал,что скорее всего у неё болит животик и прописал диетический корм. Лучше ей не становилось,сделали УЗИ живота,кровь сдали. Все в норме. Но в конце апреля она стала плохо ходить,пошли к ортопеду на рентгене все хорошо-прописали обезбол и при отсутствии динамики-мрт. Ко дню мрт она уже почти волочила задние лапки,а после мрт совсем задние лапы перестали функционировать. На мрт-эпидуральная гематома и отёк спинного мозга в грудном отделе. Я без понятия как,никто упаси Господи не мог её ударить,побить,откуда-то скинуть. Единственный вариант,что она очень любила прыгать,когда мы играли и ударилась каким-то образом. Больше предположений у меня не было и нет до сих пор... Я сделала для неё все,водила к врачу каждый день,на капельницы,колола сама,делала массаж мочевого пузыря (так как она не ходила в туалет по маленькому сама...). Вроде ей было лучше. Но как только врач отменил капельницы...за 2 дня кошка просто совсем превратилась в овощ. Я была готова,что она никогда не будет больше ходить и что ей каждый день нужен будет массаж мочевого пузыря,лишь бы она жила,но естественно не имея боли при этом.В последний раз своей более менее активности она мурчала рядом со мной,утыкалась мне в руку...   Утром 24 мая я поняла,что у неё парализовало и передние лапы,ещё она стала громко и тяжело дышать. Повезла в клинику врач сказал,что отёк пополз вверх и у неё уже начинается отёк дыхательного центра. Я будто была готова к плохому исходу,но в моменте поняла,что нет. В общем приняли решение её усыпить... Потому что естественная смерть наступила бы от асфиксии в муках. Она прожила со мной почти 4 года,я очень ей благодарна за любовь и ласку. Надеюсь,она прожила хорошую кошачью жизнь со мной.  Спи спокойно,моя малышка Кокси?????";https://sun9-52.userapi.com/s/v1/ig2/uoiXoy5bNT3os9eT98wLlwbOEOzWaR-j1WFY2tGv73AFJEqTdUe13oZM6WE82PF48f-12-5iEhXD271dPcSFz2Gu.jpg?quality=95&as=32x37,48x56,72x83,108x125,160x185,240x278,360x417,480x556,540x625,640x741,720x833,1080x1250,1280x1481,1440x1667,2212x2560&from=bu&u=aZnf942kS34rK2UvKHe3Z2uU9oxkb15imamcGv_25AA&cs=510x590;12900
714634;#help@kotrastet ??дом ??Москва и МО  Пушистый львенок Твикс ищет свою семью и дом  Мы решили спасти котейку с улицы, когда были лютые морозы. Всех его друзей, с которыми он играл летом, разобрали, и малыш остался совсем один. Его так и не пустили домой, когда отметка на градуснике показывала уже -25 С°...  Была цель: быстро найти новый дом. Но все оказалось не так просто, и Твиксику предстояло долгое и основательное лечение. И вот, оно, наконец, позади, и Твикс с нетерпением ждёт встречи с новой семьей.  Обладатель роскошной солнечной, словно позолоченной, шубки с таким же золотым характером. Замечательный котя, любвеобильный, ласковый, нежный. Обожает руки, ходит всюду хвостиком, при каждом удобном случае бодается и ласкается. Настоящий генератор урчания-мурчания.  Умный, активный, жизнерадостный, любит поиграть, но разум в безудержном веселье не теряет – все у него в меру. Успевает одновременно и с человеком пообщаться, и погладиться, и помурчать, и не забыть перекусить при этом вкусным кормом (ведь для игр нужны силы).  ??5 лет ??Привит ??Пролечен ??Обработан ??Кастрирован ??Приучен к лотку ??Ласковый и обнимательный мурчалкин ??Носитель ВИК (не опасен для людей и собак) ??Проведена операция на ушке  Если вы читаете это и понимаете, что это ваш кот – срочно звоните по телефонам для укотовления!??  +79037201276 Екатерина +79531574023 Юли  Альбом Твикса: https://vk.com/album-223933225_301228248;https://sun9-19.userapi.com/s/v1/ig2/NTRB2188IrqG13xGGqjkxbGmMoS8yBeVuTtyqVl9V7OjcciO5KXEZEZwHaZtystKFh2AvmxMDImpoSFkuB9onSh3.jpg?quality=95&as=32x48,48x72,72x108,108x162,160x240,240x359,360x539,480x719,540x808,640x958,720x1078,1080x1617,1280x1916,1440x2156,1710x2560&from=bu&u=mgbqcuYJ74VJWs01jjAWjgmDqpAe3oX58A-3wL5QNGg&cs=510x763;5778
714562;Принесла домой малышку в сентябре, когда было два с половиной месяца (1 фотография, первые шаги в новый дом). Очень активная, тактильная и ласковая девочка ? Многие как услышат что дома сиамская кошка, так сразу реагируют отрицательно, со словами «Злая наверное?». Этот котенок настолько много получает любви, что не может быть злюкой ??;https://sun9-41.userapi.com/s/v1/ig2/tXpuBxykfb8nfgxkxBaRwPANcF2Zpi0vbZ4344hdyUZCgwMbcyTvc6nkjXKEe7-u3Nlhs-m4_rx1M_GYNagp3084.jpg?quality=95&as=32x43,48x64,72x96,108x144,160x213,240x320,360x480,480x640,540x720,640x853,720x960,1080x1440,1280x1707,1440x1920,1920x2560&from=bu&u=4dHdSvZM2IKm9ceSTqCuJ8DgytF8sXoXgc8EhOpEHXc&cs=510x680;17099
714546;Мотя (Матвей/Мотик) Шотландец, 3 месяца Ездили забирать его из Тюмени, сейчас живёт в Екатеринбурге Наглый хулиган?? Но очень милый, игривый и нежный? Обожает охотиться и кусаться. Будь это игрушка, ноги или шторы - Матвею без разницы?? Любит спать в обнимку с рукой или плюшевой рыбой Владеет мячом почти как Месси??;https://sun9-8.userapi.com/s/v1/ig2/7sDCbfs3xR_uh3gMpeNm4fxELjhlZjkIixKK0jPGIrjR6NNTvRBaEiYgf-EelpyNThbivQb0KUJYPrk1iynrpmCe.jpg?quality=95&as=32x43,48x64,72x96,108x144,160x213,240x320,360x480,480x640,540x720,640x853,720x960,1080x1440,1280x1707,1440x1920,1920x2560&from=bu&u=xNiKmrdxS_QWfpdDazqYPegFnGhsoIxx3xNjEbY4Z_I&cs=510x680;10273
714530;всем привет. возможно кто-то нас помнят ещё маленькими, но если забыли то напомним! это Лёня ему год и он очень любит драться, спать с мамой и разговаривать на своём языке. ??  всем передаёт привет ?;https://sun9-48.userapi.com/s/v1/ig2/E2WYCp5R2HUEz_MRUIf3lfkU9saUpotAtbCbDO4GyCsA6cZIU-PWRELzhxZbFKKRXgfo5T1SyvhoHK55hhmFFegV.jpg?quality=95&as=32x43,48x64,72x96,108x144,160x213,240x320,360x480,480x640,540x720,640x853,720x960,1080x1440,1280x1707,1440x1920,1920x2560&from=bu&u=BNIWgdsF7MR6dJg3prowja5LKEtSJR4N6xx7h_EVXHc&cs=510x680;8848
714506;50 оттенков кисы Алисы) Мы тут уже появлялись  Киса чувствует себя замечательно Живет свою лучшую жизнь ??;https://sun9-11.userapi.com/s/v1/ig2/yrWJA7-dyhMnXt2te1uIzV82jwWU-J1gswob6DF-pzUk4DL5Ga8AY4Hlj7t8qtM-Fj5jWlF9GxtPIMU2_-VKlCbv.jpg?quality=95&as=32x43,48x64,72x96,108x144,160x213,240x320,360x480,480x640,540x720,640x853,720x960,1080x1440,1280x1707,1440x1920,1920x2560&from=bu&u=ll1junGhm8yE7vAwPLO07L4pv1hBp2BDfU-6v4Ax4dQ&cs=510x680;8538
714473;#help@kotrastet  ?? ищут дом семеро котят ??Тульская область, Донской??Москва, МО  Бездомная кошка окотилась у нас на участке, 2 недели откормила и ушла умирать.  Отда?м котят, их 7. Стараемся ухаживать за ними: обработали от блох, проглистовали, восстанавливаем им глазки.  Скоро отвез?м их ветеринару и постараемся устроить карантин для детей. Занимаемся подобным в первый раз и буду рада советам в комментариях. На авито выложили с рекламой.   Рассказываю про котят: -всем примерно по 2 месяца -нашли их в двухнедельном возрасте -один из малышей приставучий трактор, всегда есть до всего дело. Ляжет на Вас и будет до победного урчать -очень крупный, к рукам приучен, охотно на них лежит -нелюдимый, пока бегает от нас, но знает место -учится мяукать, пытается с нами заговорить  Остальные пока не сильно выделились, трое будут с длинной шерстью и четверо с гладкой.  Мы готовы оставить одного, но остальным хотим найти любящих укотовителей????  Если необходимо, то привез?м ближе к Вам (Тульская обл., МО, Москва)   К лотку приучаем, все ходят в туалет подальше от еды и лежанки.  Если Вас заинтересовали котята и хотите приехать, посмотреть - будем очень рады. Готовы прислать и видео, и дополнительные фото.  Находятся котята в Донском.;https://sun9-70.userapi.com/s/v1/ig2/wkZEsTHZP5Gos0nETC01aNj6thQDC5vJJhKkeu53HnF3J546mBfebkoRGdRBkTpnF06YTZYsUaQ2mM7QvTwJflr7.jpg?quality=95&as=32x32,48x48,72x72,108x108,160x160,240x240,360x360,480x480,540x540,640x640,720x720,1080x1080,1280x1280,1440x1440,2560x2560&from=bu&u=KQWF_VLNDUYg32fWLp5_sg3UO2zDyMdeF1FUruMQz9E&cs=510x510;6349
714431;Знакомьтесь,Шило?? Возраст 1 годик?? Любит грызть коробки,много кушать,мочить лапки в ванной и не давать спать маме с папой по утрам??;https://sun9-49.userapi.com/s/v1/ig2/H1YuPDxOezt6SxXNEe8ChMiR20GhoAWthXmhqE5gL5Kwqz3OxWCsD8NWguzr6e363r27fW7tF99XSmZlJAnQMqIi.jpg?quality=95&as=32x43,48x64,72x96,108x144,160x213,240x320,360x480,480x640,540x720,640x853,720x960,1080x1440,1280x1707,1440x1920,1920x2560&from=bu&u=wNAaLqkNDRf-3hgLBD9DLl2KJf2U4DWxl-AfAY2grME&cs=510x680;31121
714216;Всем привет! Меня зовут Kia и мне год??  1. Мама с папой забрали меня из Перми, ехали 6 часов, первое фото дома?? 2. Подрала тюль за которую маме пришлось платить ?? 3. Наблюдала за мамой и упала в ванну, сразу пошла какать?? 4. Распаковываю косметику  5. Смотрю как мама моется, но больше не лезу  6. Едем к бабушке 7. Мама узнала, что я беременна  8. Показываю котят маме 9. Выросли мои дети…;https://sun9-70.userapi.com/s/v1/ig2/tzl1mP3YaJV5At--06ejjM3NnfjDnyBqFFIZHZLZpRaPQxaMrNRKQgDH1Q7Yj3ckaFgcCrQBk-Ff6FRb-0PHIN8s.jpg?quality=95&as=32x43,48x64,72x96,108x144,160x213,240x320,360x480,480x640,540x720,640x853,720x960,1080x1440,1280x1707,1440x1920,1920x2560&from=bu&u=JVg5d8m9KdE5Jg-mKqZZZblHhi7ruKC4B6us9JVCho0&cs=510x680;84585
